Sheet: Sheet1
A1: The Inventory
A3: Item | B3: Value | C3: Total
A4: Coat | B4: 49.99 | C4: =RC[-1] -> 49.99
A5: Jeans | B5: 19.99 | C5: =R[-1]C +RC[-1] -> 69.98
A6: Shirt | B6: 18.95 | C6: =R[-1]C +RC[-1] -> 88.93
A7: Hat | B7: 10 | C7: =R[-1]C +RC[-1] -> 98.93
A8: Glasses | B8: 59.99 | C8: =R[-1]C +RC[-1] -> 158.92000000000002
A9: Shoes | B9: 29.95 | C9: =R[-1]C +RC[-1] -> 188.87
A10: Other | B10: 39 | C10: =R[-1]C +RC[-1] -> 227.87